{
  "$schema": "http://json-schema.org/draft-07/schema#",
  "$id": "https://w-model-dev/schemas/coverage.schema.json",
  "description": "需求覆盖分析（coverage.json）结构 schema，对应 coverage-logic.ts C1-C10 四矩阵完整性/100% 覆盖率校验",
  "title": "CoverageShape",
  "type": "object",
  "additionalProperties": false,
  "required": ["stakeholders", "scenarios", "requirementTypes", "crossCuts", "metrics"],
  "properties": {
    "stakeholders": {
      "description": "干系人覆盖矩阵数组（C1 校验非空；status=partial/missing 须填 gapDescription，C8 100% 阈值不允许 partial/missing）",
      "type": "array",
      "items": {
        "description": "单条干系人覆盖矩阵行（stakeholder：id + role + 关联需求 + status）",
        "type": "object",
        "additionalProperties": false,
        "required": ["id", "role", "relatedReqs", "status"],
        "properties": {
          "id": { "description": "干系人 ID（如 STK-NNN），须唯一", "type": "string" },
          "role": { "description": "干系人角色描述（如 终端用户 / 管理员 / 审核者）", "type": "string" },
          "relatedReqs": {
            "description": "该干系人关联的需求 ID 数组（对应 graph.json REQ 节点 ID，建议 ≥1 条）",
            "type": "array",
            "items": { "type": "string" }
          },
          "status": {
            "description": "覆盖状态：covered=已覆盖 / partial=部分覆盖 / missing=未覆盖（partial 命中 C8 不达标；missing 须在 Out of Scope 显式声明，C9）",
            "enum": ["covered", "partial", "missing"]
          },
          "gapDescription": {
            "description": "覆盖缺口说明（可选；status=partial/missing 或声明 Out of Scope 时建议填写原因）",
            "type": "string"
          }
        }
      }
    },
    "scenarios": {
      "description": "场景覆盖矩阵数组（C3 校验非空；C4 校验 happy/error/boundary 三类须齐全）",
      "type": "array",
      "items": {
        "description": "单条场景覆盖矩阵行（scenario：id + 步骤 + 关联需求 + status）",
        "type": "object",
        "additionalProperties": false,
        "required": ["id", "description", "steps", "relatedReqs", "status", "scenarioType"],
        "properties": {
          "id": { "description": "场景 ID（如 SC-NNN），须唯一", "type": "string" },
          "description": { "description": "场景描述文本（Given/When/Then 语义概要）", "type": "string" },
          "steps": {
            "description": "场景步骤列表（每一步为一条 Given/When/Then 描述字符串）",
            "type": "array",
            "items": { "type": "string" }
          },
          "relatedReqs": {
            "description": "场景关联的需求 ID 数组（对应 graph.json REQ 节点 ID）",
            "type": "array",
            "items": { "type": "string" }
          },
          "status": {
            "description": "覆盖状态：covered=已覆盖 / partial=部分覆盖 / missing=未覆盖（missing 须在 Out of Scope 显式声明，C9）",
            "enum": ["covered", "partial", "missing"]
          },
          "scenarioType": {
            "description": "场景类型：happy=正向正常流程 / error=异常与错误处理 / boundary=边界与极限条件（C4 校验三类须齐全）",
            "enum": ["happy", "error", "boundary"]
          },
          "gapDescription": {
            "description": "覆盖缺口说明（可选；status=partial/missing 或声明 Out of Scope 时建议填写原因）",
            "type": "string"
          }
        }
      }
    },
    "requirementTypes": {
      "description": "需求类型覆盖矩阵数组（C5 校验 REQ/NFR/CON 三类须齐全）",
      "type": "array",
      "items": {
        "description": "单条需求类型覆盖矩阵行（requirementType：type + 需求集合 + status）",
        "type": "object",
        "additionalProperties": false,
        "required": ["type", "reqIds", "status"],
        "properties": {
          "type": {
            "description": "需求类型：REQ=功能需求 / NFR=非功能需求 / CON=约束（C5 校验三类齐全）",
            "enum": ["REQ", "NFR", "CON"]
          },
          "reqIds": {
            "description": "该类型下的需求 ID 数组（对应 graph.json 中该类型的节点 ID）",
            "type": "array",
            "items": { "type": "string" }
          },
          "status": {
            "description": "覆盖状态：covered=已覆盖 / partial=部分覆盖 / missing=未覆盖（missing 须在 Out of Scope 显式声明，C9）",
            "enum": ["covered", "partial", "missing"]
          },
          "gapDescription": {
            "description": "覆盖缺口说明（可选；status=partial/missing 或声明 Out of Scope 时建议填写原因）",
            "type": "string"
          }
        }
      }
    },
    "crossCuts": {
      "description": "横切覆盖矩阵数组（C7 校验与 graph.json cross-cuts 边集双向一致：coverage 有 graph 无、或 graph 有 coverage 无均报违反）",
      "type": "array",
      "items": {
        "description": "单条横切关注点覆盖矩阵行（crossCut：NFR/CON + 治理需求集合 + status）",
        "type": "object",
        "additionalProperties": false,
        "required": ["nfrConId", "governedReqs", "status"],
        "properties": {
          "nfrConId": {
            "description": "横切 NFR/CON 节点 ID（对应 graph.json 中 NFR/CON 节点，C7 边源一致性）",
            "type": "string"
          },
          "governedReqs": {
            "description": "受该横切治理的需求 ID 数组（每条 nfrConId→req 须与 graph.json cross-cuts 边一一对应，C7 双向校验）",
            "type": "array",
            "items": { "type": "string" }
          },
          "status": {
            "description": "覆盖状态：covered=已覆盖 / partial=部分覆盖 / missing=未覆盖（missing 须在 Out of Scope 显式声明，C9）",
            "enum": ["covered", "partial", "missing"]
          },
          "gapDescription": {
            "description": "覆盖缺口说明（可选；status=partial/missing 或声明 Out of Scope 时建议填写原因）",
            "type": "string"
          }
        }
      }
    },
    "metrics": {
      "description": "四维覆盖率指标（百分比数值 0-100；C8 校验 4 项均须 =100，存在 partial 项亦判失败；C10 与按 (covered+0.5×partial)/总数×100 重算结果一致）",
      "type": "object",
      "additionalProperties": false,
      "required": ["stakeholder", "scenario", "requirementType", "crossCut"],
      "properties": {
        "stakeholder": {
          "description": "干系人维度覆盖率（百分比 0-100，C8 须 =100，C10 重算一致性）",
          "type": "number"
        },
        "scenario": { "description": "场景维度覆盖率（百分比 0-100，C8 须 =100，C10 重算一致性）", "type": "number" },
        "requirementType": {
          "description": "需求类型维度覆盖率（百分比 0-100，C8 须 =100，C10 重算一致性）",
          "type": "number"
        },
        "crossCut": { "description": "横切维度覆盖率（百分比 0-100，C8 须 =100，C10 重算一致性）", "type": "number" }
      }
    }
  }
}
